{
  "task_id": "FIX-002",
  "timestamp": 1779427200,
  "trace_id": "c3d4e5f6-a7b8-9c0d-1e2f-3a4b5c6d7e8f",
  "goal": "架构整理重构：constraints/只放技术约束，R规则统一放rules/目录（每个规则独立文件），P前缀废弃并入R编号，删除arch-layering.md和agent-system.md，AGENTS.md精简为入口角色",
  "files_to_modify": [
    "AGENTS.md",
    "opencode.jsonc",
    ".opencode/constraints/contract-mechanism.md",
    ".opencode/contracts/contract-schema.json",
    ".opencode/rules/R-01_source-modification-contract.md",
    ".opencode/rules/R-02_coverage-all-files.md",
    ".opencode/rules/R-03_coverage-closure.md",
    ".opencode/rules/R-04_status-update.md",
    ".opencode/rules/R-05_contract-naming.md",
    ".opencode/rules/R-06_workflow-integrity.md",
    ".opencode/rules/R-07_contract-scope.md",
    ".opencode/rules/R-08_coordinator-gate.md",
    ".opencode/rules/R-09_web-search-timestamp.md",
    ".opencode/rules/R-10_builder-workspace-clean.md",
    ".opencode/rules/R-11_no-indiscriminate-kill.md",
    ".opencode/rules/R-12_service-agent-required.md",
    ".opencode/rules/R-13_heartbeat-required.md",
    ".opencode/rules/R-14_auto-retry-loop.md",
    ".opencode/rules/R-15_hook-implementation.md",
    ".opencode/rules/R-16_trace-id.md",
    ".opencode/rules/R-17_six-pillars-coverage.md",
    ".opencode/rules/R-18_model-list-consistency.md"
  ],
  "constraints": ["contract-mechanism"],
  "tech_stack_constraints": [],
  "hooks": { "pre_task": [], "post_task": [] },
  "verification": [
    "grep -c 'P-0' AGENTS.md",
    "test ! -f .opencode/constraints/agent-system.md && echo 'agent-system.md deleted'",
    "test ! -f .opencode/constraints/arch-layering.md && echo 'arch-layering.md deleted'",
    "ls .opencode/rules/R-*.md | wc -l"
  ],
  "coverage_checklist": {
    "r_numbering_continuous": "assert: R-01~R-18 文件全部存在且编号连续",
    "p_prefix_abolished": "assert: AGENTS.md/constraints/agents/ 中无 P-01~P-04 残留引用",
    "agent_system_deleted": "assert: agent-system.md 已删除",
    "arch_layering_deleted": "assert: arch-layering.md 已删除",
    "code_rules_replaced": "assert: code_rules.md 已删除，被 R-xx 体系取代",
    "contract_mechanism_updated": "assert: contract-mechanism.md 内部编号更新为新体系",
    "agents_md_index_updated": "assert: AGENTS.md 规则索引表指向 rules/ 目录文件",
    "opencode_jsonc_updated": "assert: opencode.jsonc instructions 不含已删除文件",
    "tech_stack_intact": "assert: tech-stack/ 文件未修改",
    "git_push": "SKIP: 需要外部 Git 凭据"
  },
  "status": "completed",
  "retry_count": 0,
  "workflow_phases": ["plan"]
}
